{
  "source": "crowd-eq",
  "revision": "d7e266cac1526ae7db52ea16c744595a05b9df27",
  "tools": {"python":"3.14.7","numpy":"2.5.4","pyarrow":"26.0.0"},
  "eq_curves": 1595,
  "reverb_rows": 6772,
  "reverb_distinct_settings": 256,
  "eq": [
    {"word":"aburrido","n":2,"value":0.72,"class":"unknown","few_sample":true},
    {"word":"acariciante","n":1,"value":null,"class":"unknown","few_sample":true},
    {"word":"activo","n":1,"value":null,"class":"unknown","few_sample":true},
    {"word":"afilado","n":2,"value":0.5,"class":"unknown","few_sample":true},
    {"word":"aggravating","n":2,"value":0.81,"class":"unknown","few_sample":true},
    {"word":"aggressive","n":4,"value":-0.15,"class":"unknown","few_sample":true},
    {"word":"agitado","n":1,"value":null,"class":"unknown","few_sample":true},
    {"word":"agitated","n":1,"value":null,"class":"unknown","few_sample":true},
    {"word":"agotador","n":1,"value":null,"class":"unknown","few_sample":true},
    {"word":"agradable","n":2,"value":-0.56,"class":"unknown","few_sample":true},
    {"word":"agresividad","n":1,"value":null,"class":"unknown","few_sample":true},
    {"word":"agresivo","n":2,"value":0.59,"class":"unknown","few_sample":true},
    {"word":"agrio","n":1,"value":null,"class":"unknown","few_sample":true},
    {"word":"agudo","n":5,"value":0.64,"class":"unknown","few_sample":true,"bands":{"low":-1.4,"low_mid":-0.1,"mid":0.98,"high":0.12,"air":0.11},"peak_hz":1452},
    {"word":"aidan","n":1,"value":null,"class":"unknown","few_sample":true},
    {"word":"airy","n":3,"value":0.63,"class":"unknown","few_sample":true},
    {"word":"alegre","n":5,"value":0.19,"class":"unknown","few_sample":true,"bands":{"low":-0.89,"low_mid":0.25,"mid":0.58,"high":0.24,"air":-0.45},"peak_hz":729},
    {"word":"alegré","n":1,"value":null,"class":"unknown","few_sample":true},
    {"word":"alegría","n":1,"value":null,"class":"unknown","few_sample":true},
    {"word":"alluring","n":1,"value":null,"class":"unknown","few_sample":true},
    {"word":"alto","n":10,"value":0.0,"class":"low","few_sample":false,"bands":{"low":-0.62,"low_mid":0.06,"mid":0.05,"high":0.32,"air":0.07},"peak_hz":7875},
    {"word":"amable","n":2,"value":-0.54,"class":"unknown","few_sample":true},
    {"word":"amanecer","n":1,"value":null,"class":"unknown","few_sample":true},
    {"word":"amargado","n":1,"value":null,"class":"unknown","few_sample":true},
    {"word":"amargoso","n":1,"value":null,"class":"unknown","few_sample":true},
    {"word":"amigable","n":1,"value":null,"class":"unknown","few_sample":true},
    {"word":"amistoso","n":1,"value":null,"class":"unknown","few_sample":true},
    {"word":"amor","n":1,"value":null,"class":"unknown","few_sample":true},
    {"word":"angelical","n":1,"value":null,"class":"unknown","few_sample":true},
    {"word":"anger","n":1,"value":null,"class":"unknown","few_sample":true},
    {"word":"angry","n":2,"value":-0.36,"class":"unknown","few_sample":true},
    {"word":"animado","n":1,"value":null,"class":"unknown","few_sample":true},
    {"word":"annoying","n":1,"value":null,"class":"unknown","few_sample":true},
    {"word":"ansioso","n":1,"value":null,"class":"unknown","few_sample":true},
    {"word":"anticipación","n":1,"value":null,"class":"unknown","few_sample":true},
    {"word":"anticipation","n":1,"value":null,"class":"unknown","few_sample":true},
    {"word":"apacible","n":1,"value":null,"class":"unknown","few_sample":true},
    {"word":"apagado","n":4,"value":0.81,"class":"unknown","few_sample":true},
    {"word":"apasionada","n":1,"value":null,"class":"unknown","few_sample":true},
    {"word":"apple","n":1,"value":null,"class":"unknown","few_sample":true},
    {"word":"apresurado","n":1,"value":null,"class":"unknown","few_sample":true},
    {"word":"arcaico","n":2,"value":0.68,"class":"unknown","few_sample":true},
    {"word":"archaic","n":1,"value":null,"class":"unknown","few_sample":true},
    {"word":"armonioso","n":3,"value":-0.19,"class":"unknown","few_sample":true},
    {"word":"armonía","n":2,"value":0.66,"class":"unknown","few_sample":true},
    {"word":"armónico","n":1,"value":null,"class":"unknown","few_sample":true},
    {"word":"aromático","n":1,"value":null,"class":"unknown","few_sample":true},
    {"word":"arriesgado","n":1,"value":null,"class":"unknown","few_sample":true},
    {"word":"asqueroso","n":3,"value":0.02,"class":"unknown","few_sample":true},
    {"word":"aterrador","n":1,"value":null,"class":"unknown","few_sample":true},
    {"word":"atonal","n":1,"value":null,"class":"unknown","few_sample":true},
    {"word":"atroz","n":1,"value":null,"class":"unknown","few_sample":true},
    {"word":"audaz","n":2,"value":-0.01,"class":"unknown","few_sample":true},
    {"word":"autoritario","n":1,"value":null,"class":"unknown","few_sample":true},
    {"word":"awesome","n":2,"value":-0.66,"class":"unknown","few_sample":true},
    {"word":"awkward","n":1,"value":null,"class":"unknown","few_sample":true},
    {"word":"azul","n":1,"value":null,"class":"unknown","few_sample":true},
    {"word":"aéreo","n":1,"value":null,"class":"unknown","few_sample":true},
    {"word":"bag","n":1,"value":null,"class":"unknown","few_sample":true},
    {"word":"bailable","n":1,"value":null,"class":"unknown","few_sample":true},
    {"word":"bajo","n":5,"value":0.57,"class":"unknown","few_sample":true,"bands":{"low":1.27,"low_mid":0.12,"mid":-0.94,"high":-0.46,"air":0.38},"peak_hz":20},
    {"word":"balanced","n":1,"value":null,"class":"unknown","few_sample":true},
    {"word":"balón","n":1,"value":null,"class":"unknown","few_sample":true},
    {"word":"bang","n":1,"value":null,"class":"unknown","few_sample":true},
    {"word":"baseball","n":1,"value":null,"class":"unknown","few_sample":true},
    {"word":"bassy","n":1,"value":null,"class":"unknown","few_sample":true},
    {"word":"bear","n":1,"value":null,"class":"unknown","few_sample":true},
    {"word":"beautiful","n":10,"value":-0.02,"class":"low","few_sample":false,"bands":{"low":0.44,"low_mid":0.15,"mid":-0.21,"high":-0.09,"air":-0.23},"peak_hz":120},
    {"word":"bello","n":3,"value":0.24,"class":"unknown","few_sample":true},
    {"word":"big","n":1,"value":null,"class":"unknown","few_sample":true},
    {"word":"biting","n":1,"value":null,"class":"unknown","few_sample":true},
    {"word":"bizantino","n":1,"value":null,"class":"unknown","few_sample":true},
    {"word":"bizarro","n":1,"value":null,"class":"unknown","few_sample":true},
    {"word":"blanco","n":1,"value":null,"class":"unknown","few_sample":true},
    {"word":"blaring","n":1,"value":null,"class":"unknown","few_sample":true},
    {"word":"blast","n":1,"value":null,"class":"unknown","few_sample":true},
    {"word":"boisterous","n":1,"value":null,"class":"unknown","few_sample":true},
    {"word":"bold","n":2,"value":0.52,"class":"unknown","few_sample":true},
    {"word":"bonito","n":1,"value":null,"class":"unknown","few_sample":true},
    {"word":"boom","n":1,"value":null,"class":"unknown","few_sample":true},
    {"word":"booming","n":1,"value":null,"class":"unknown","few_sample":true},
    {"word":"bored","n":1,"value":null,"class":"unknown","few_sample":true},
    {"word":"bouncy","n":1,"value":null,"class":"unknown","few_sample":true},
    {"word":"boxy","n":1,"value":null,"class":"unknown","few_sample":true},
    {"word":"brash","n":1,"value":null,"class":"unknown","few_sample":true},
    {"word":"brass","n":1,"value":null,"class":"unknown","few_sample":true},
    {"word":"brassy","n":2,"value":0.53,"class":"unknown","few_sample":true},
    {"word":"brave","n":1,"value":null,"class":"unknown","few_sample":true},
    {"word":"bravo","n":1,"value":null,"class":"unknown","few_sample":true},
    {"word":"breezy","n":1,"value":null,"class":"unknown","few_sample":true},
    {"word":"breve","n":1,"value":null,"class":"unknown","few_sample":true},
    {"word":"bright","n":19,"value":0.34,"class":"medium","few_sample":false,"bands":{"low":-1.06,"low_mid":-0.13,"mid":0.48,"high":0.59,"air":-0.18},"peak_hz":4392},
    {"word":"brillante","n":6,"value":0.21,"class":"unknown","few_sample":true,"bands":{"low":-0.76,"low_mid":0.58,"mid":0.44,"high":0.1,"air":-0.61},"peak_hz":729},
    {"word":"brittle","n":1,"value":null,"class":"unknown","few_sample":true},
    {"word":"buena","n":1,"value":null,"class":"unknown","few_sample":true},
    {"word":"bueno","n":1,"value":null,"class":"unknown","few_sample":true},
    {"word":"bullicio","n":1,"value":null,"class":"unknown","few_sample":true},
    {"word":"buzz","n":2,"value":0.46,"class":"unknown","few_sample":true},
    {"word":"calidad","n":1,"value":null,"class":"unknown","few_sample":true},
    {"word":"caliente","n":12,"value":-0.04,"class":"low","few_sample":false,"bands":{"low":0.34,"low_mid":0.12,"mid":-0.06,"high":-0.07,"air":-0.31},"peak_hz":83},
    {"word":"calm","n":13,"value":0.27,"class":"medium","few_sample":false,"bands":{"low":-0.15,"low_mid":-0.64,"mid":-0.45,"high":0.59,"air":0.7},"peak_hz":12474},
    {"word":"calmada","n":1,"value":null,"class":"unknown","few_sample":true},
    {"word":"calmado","n":2,"value":0.88,"class":"unknown","few_sample":true},
    {"word":"calmante","n":2,"value":-0.26,"class":"unknown","few_sample":true},
    {"word":"calmo","n":1,"value":null,"class":"unknown","few_sample":true},
    {"word":"cambio","n":1,"value":null,"class":"unknown","few_sample":true},
    {"word":"camino","n":2,"value":-0.32,"class":"unknown","few_sample":true},
    {"word":"canción","n":1,"value":null,"class":"unknown","few_sample":true},
    {"word":"cansado","n":2,"value":-0.36,"class":"unknown","few_sample":true},
    {"word":"cansancio","n":1,"value":null,"class":"unknown","few_sample":true},
    {"word":"cantaso","n":1,"value":null,"class":"unknown","few_sample":true},
    {"word":"car","n":1,"value":null,"class":"unknown","few_sample":true},
    {"word":"carefree","n":1,"value":null,"class":"unknown","few_sample":true},